{
  "person": {
    "name": "Riley Placeholder",
    "role": "Controller"
  },
  "company": {
    "name": "Lumen Ledger",
    "domain": "lumen.example.org"
  },
  "evidence": "Account brief — Lumen Ledger (lumen.example.org), 2026-10-13.\n- What they do: subscription bookkeeping for dental clinics (lumen.example.org).\n- Moved invoicing to a new ERP on 2026-09-02 (lumen.example.org/blog/erp-move).\n- Posted a job for a billing operations analyst on 2026-09-29 (jobs.example.org/lumen-billing).\n- Likely problem owner: Controller (a guess, based on the job post reporting line).\nOpen questions: number of clinics served; current reconciliation tool.",
  "channel": "email",
  "voice_samples": [],
  "offer": "We reconcile invoices against payments automatically for small finance teams.",
  "now": "2026-10-14T08:30:00Z"
}
